{
  "id": "mem_4Fq8Wz2K",
  "user_id": "alex",
  "kind": "preference",
  "content": "Alex bevorzugt abends warmweißes Licht (2700 K) und gedimmte Helligkeit.",
  "triple": { "subject": "user:alex", "predicate": "prefers.light.evening", "object": "2700K, 40%" },
  "importance": 0.7,
  "confidence": 0.8,
  "sensitivity": "personal",
  "source": { "type": "observation", "ref": "automation_runs/aut_evening/2026-09" },
  "tags": ["licht", "abend"],
  "valid_from": "2026-09-01T00:00:00Z",
  "valid_until": null,
  "created_at": "2026-09-20T21:14:00Z",
  "last_accessed_at": "2026-09-26T19:42:05Z",
  "access_count": 12,
  "embedding_model": "bge-m3"
}
